NAME,STREET,CITY,STATE,ZIP,AFFILIATION,RULING,FOUNDATION,ACTIVITY,ORGANIZATION,x,y
CHRISTIAN LIFE FELLOWSHIP OF NEW JERSEY,45 FERRY ST,SOUTH RIVER,NJ,8882,3,200209,10,0,1,-8279829.17744766,4931754.475940054
CONGREGATION KEREN YAAKOV HERSH AND FAIGA INC,14 AUGUSTA AVE,MONSEY,NY,10952,3,200207,10,0,1,-8245916.807772396,5028440.731017516
ST INNOCENT OF ALASKA ORTHODOX MISSION,PO BOX 1471,ONEONTA,NY,13820,9,197210,10,1000000,1,-8355863.729244186,5229602.085429335
HEIRESS OF GOD PENTECOSTAL CHURCH INC IGLESIA PENTECOSTAL HEREDAD DE,221 SCHRADE RD STE 1-E,BRIARCLIFF,NY,10510,3,200311,10,0,1,-8218243.005000168,5035835.94591081
FAITH MISSIONARY BAPTIST CHURCH,700 SOUTH AVE,SYRACUSE,NY,13207,3,200301,10,0,5,-8477960.950497082,5316800.896757012
CONG ZICHRON YESHIA INC,1403 44TH ST PMB 227,BROOKLYN,NY,11219,3,200307,10,0,1,-8236180.916427105,4958864.083085428
KOLEL BAIS BRAUCH SANZ GRIBOV,1256 44TH ST,BROOKLYN,NY,11219,3,200302,10,0,1,-8236529.791711249,4959132.976126391
PRAYER CENTER OUTREACH MINISTRIES,33 ELBA ST,ROCHESTER,NY,14608,3,200604,10,0,1,-8641236.475908814,5332691.430784936
BNEI GIBOREI YISROEL INC,630 CLIFTON AVE,LAKEWOOD,NJ,8701,3,200209,10,0,1,-8261631.223690229,4879980.123833745
MT SINAI MINISTRIES INC,PO BOX 19804,ROCHESTER,NY,14619,3,200211,10,0,1,-8643464.869475514,5332668.853675528
YOGA DEVANAND SPIRITUAL CENTER INC,2285 SEDGWICK AVE APT 102,BRONX,NY,10468,3,200301,15,0,1,-8227586.38382092,4991953.641168329
INTERNATIONAL GOSPEL FELLOWSHIP,650 PARK AVE,WINDSOR,CT,6095,3,200309,10,0,1,-8090785.750265575,5136523.348478523
HOUN-AN DHARMA CLOUD HERMITAGE INC,210 BELMONT ST APT 8,WATERTOWN,MA,2472,3,200302,10,0,1,-7921435.854199731,5217529.109000359
TABERNACLE OF GOD CHRISTIAN ASSEMBLY,683 CAREW ST,SPRINGFIELD,MA,1104,3,200407,10,0,1,-8080307.2465972025,5179497.8853122555
ELIM CHRISTIAN FELLOWSHIP OF ROCHESTER NEW YORK INC,PO BOX 1498,BUFFALO,NY,14215,3,200308,10,0,1,-8772037.322868872,5303040.003523744
ADVENT HERALDS INC,250 NEW YORK AVE,BROOKLYN,NY,11216,3,200304,10,0,1,-8231806.6170363845,4964049.900988995
FRANCIS LEWIS BLVD-HAITIAN CHURCH OF GOD,11205 FRANCIS LEWIS BLVD,QUEENS VLG,NY,11429,9,197210,10,0,5,-8209780.497310067,4968795.434344282
HOLY VINE MINISTRIES INC,7 OHIO AVE,SPRING VALLEY,NY,10977,3,200211,10,0,1,-8242126.490430371,5029948.137482246
PRAISE INTERNATIONAL WORSHIP AND DELIVERANCE CENTER,590 LIVONIA AVE,BROOKLYN,NY,11207,3,200407,10,0,1,-8225995.739616972,4962984.105740504
SPANISH MENNONITE CHURCH,728 E WOOD ST,VINELAND,NJ,8360,3,201006,10,0,1,-8351109.162472915,4791666.113371439
RABBINICAL ORGANIZATION-CHABAD LUBAVITCH INC,1394 CARROLL ST STE 4,BROOKLYN,NY,11213,3,200310,15,0,1,-8231218.404847031,4963299.634790248
JEWISH LIFE SERIES FOUNDATION,14759 76TH RD,FLUSHING,NY,11367,3,200412,15,0,1,-8217083.72382305,4971606.110469265
LIGHT & SALT PRESBYTERIAN CHURCH INC,109 HARDENBURGH AVE,DEMAREST,NJ,7627,3,200301,10,0,1,-8233842.205245029,5006041.482344829
HEIRS OF PROMISE INTERNATIONAL MINISTRIES INC,1120 MANOR AVE 1ST FLR,BRONX,NY,10472,3,200307,10,0,1,-8223827.235936321,4986853.034035993
FAITH FELLOWSHIP OF SOUTHERN NEW JERSEY,1415 SWAN LN,MULLICA HILL,NJ,8062,3,200305,10,0,1,-8374969.048171073,4825557.187593617
ASSEMBLY OF GOD CENTRAL CHURCH,269 STONY HILL RD APT T12,WILBRAHAM,MA,1095,3,200303,10,0,1,-8067690.740788655,5182579.066155339
WAVES OF GLORY CHRISTIAN CENTER,1305 BRIARWOOD DR,WILLIAMSTOWN,NJ,8094,3,200307,10,0,1,-8347231.014052661,4815820.6786760455
SINO-AMERICAN BUDDHIST ASSOCIATION LINGSHAN TEMPLE INC,4318 91ST PL,ELMHURST,NY,11373,3,200309,10,0,1,-8223662.260450965,4974528.966187279
HAITIAN BERACHAH BAPTIST CHURCH INC,900 WHEATSHEAF RD,LINDEN,NJ,7036,3,200306,10,0,1,-8266536.405732542,4959206.031812283
LIVING WORD MINISTERIES OF BRIDGEPORT INC,PO BOX 55316,BRIDGEPORT,CT,6610,3,200508,10,0,1,-8144352.021318355,5041051.830442882
PRAYER HOUSE OF DELIVERANCE CHURCH,373 MARION ST APT 1,BROOKLYN,NY,11233,3,200706,10,0,1,-8228107.136398852,4965462.530069202
AMERICAN FRIENDS OF CHABAD OF THAILAND INC,80 SHORE RD,PRT WASHINGTN,NY,11050,3,200306,15,0,1,-8204758.095843947,4988762.910898418
GRACE CHRISTIAN FELLOWSHIP,74 HARNED AVE,PERTH AMBOY,NJ,8861,9,195906,10,1000000,1,-8270154.066544339,4943892.681193285
GRACE CHRISTIAN FELLOWSHIP A CONGREGATION OF GRACE COMMUNION IN,93 DREW CT,MANALAPAN,NJ,7726,9,195906,10,1000000,1,-8271807.160982623,4911048.024922221
FAZZINO ELECTRIC LLC,31 BARRINGTON WAY,GLASTONBURY,CT,6033,9,198309,10,1000000,1,-8080005.5707771545,5120740.692327652
METROPOLITAN NEW YORK PRESBYTERY,4143 43RD ST APT E8,SUNNYSIDE,NY,11104,9,197404,10,1000000,1,-8228837.726216925,4974972.113101844
F R I E N D S -THROUGH JESUS CHRIST INC,24503 149TH RD,ROSEDALE,NY,11422,3,200602,10,0,1,-8208516.798450576,4961203.391763515
BNEI AILIM,1358 47TH ST B-3,BROOKLYN,NY,11219,3,200402,10,0,1,-8236467.564115901,4958681.011196801
EVANGELICAL CHURCH CHRIST LIVES IN ME WORLDWIDE MOVEMENT INC,1102 LONGFELLOW AVE APT 1E,BRONX,NY,10459,3,200405,10,0,1,-8225159.618921629,4986784.7732687695
JESUS ELAM REVIVAL ASSEMBLY INC,76 COURSEN PL,STATEN ISLAND,NY,10304,3,200411,10,0,1,-8246526.50462347,4956381.168732716
YE SERVANT OF GOD TEMPLE INC,706 E 227TH ST APT 3,BRONX,NY,10466,3,201009,10,0,1,-8221990.798296703,4995996.791512633
CONG ZICHRON OHEL ELIMELECH TOSH INC,146 MAPLE AVENUE,SPRING VALLEY,NY,10977,3,200402,10,0,1,-8243677.393576104,5029612.711152953
FRIENDS OF THE BIYALA YESHIVA CORP A NOT FOR PROFIT FLORIDA CORP,199 LEE AVE STE 178,BROOKLYN,NY,11211,3,200503,10,0,1,-8232724.334918483,4968493.530773376
KHALUTZAY BNAI YISRAEL INC,2995 MARION AVE APT 5E,BRONX,NY,10458,3,200506,10,0,1,-8224567.510550101,4993196.750103605
AISH LIVINGSTON INC,3 FOREST CT,PASSAIC,NJ,7055,3,200410,15,0,1,-8253641.712516503,4990080.96020441
RAMAPO VALLEY ASSEMBLY OF GOD,1122 RAMAPO VALLEY RD,MAHWAH,NJ,7430,9,196408,10,1002029,5,-8261391.66414604,5020689.752971415
CENTRO CRISTIANO DE RESTAURACION Y AVIVAMIENTO INC,7817 17TH AVE,BROOKLYN,NY,11214,3,200405,10,0,1,-8237694.750182401,4955387.328649802
GREATER MOUNT CARMEL DELIVERANCE MINISTRIES LOCAL AND INTL INC,215 SCHENECTADY AVE,BROOKLYN,NY,11213,3,200806,10,0,1,-8230251.372430509,4964000.292410586
BREAD OF LIFE FELLOWSHIP CENTER INC,308 MORSE ST # 310,HAMDEN,CT,6517,3,200406,10,0,1,-8118565.195234564,5062253.240008389
CONGREGATION KOIFER NEFESH INC,PO BOX 1288,MONSEY,NY,10952,3,200609,10,0,1,-8244843.79920064,5029580.499014647
CHESED INC,86 EAST AMHERST UNIT A-1,BUFFALO,NY,14214,3,200310,10,0,1,-8775819.959166026,5302881.096972299
HOPE TABERNACLE APOSTOLIC CHURCH,91 GREEN MANOR AVE,WINDSOR,CT,6095,3,201008,10,0,1,-8089505.019523999,5134529.952967361
LESSER FRANCISCANS,176 HOLDEN ST,ATTLEBORO,MA,2703,3,200602,10,0,1,-7934636.008098507,5153984.779223423
MOUNT SAINT FRANCIS HERMITAGE INC,PO BOX 236,MAINE,NY,13802,9,194603,10,0,1,-8465953.250983683,5198839.131990916
GRACE BAPTIST CHURCH,9801 FOSTER AVE,BROOKLYN,NY,11236,3,201708,10,0,1,-8227028.78449154,4960712.890210967
BUFFALO MYANMAR INDIGENOUS CHRISTIAN FELLOWSHIP,452 EAST ST,BUFFALO,NY,14207,9,195504,10,1000000,1,-8783652.398538241,5303358.128858475
FRATERNIDAD CRISTIANA STAMFORD INC,733 SUMMER ST STE 405,STAMFORD,CT,6901,3,201608,10,0,1,-8186440.4736339105,5020968.918798867
ABIDING LOVE INTERNATIONAL FELLOWSHIP,210 GENESEE ST,TRENTON,NJ,8611,3,200802,10,0,1,-8321220.992389832,4896249.015476868
ST BRENDAN,60 TURNER AVE,RIVERSIDE,RI,2915,9,200702,15,0,5,-7943664.575399293,5126745.004402629
ALL NATIONS CHURCH OF GOD,19 POLHEMUS DR,HILLSBOROUGH,NJ,8844,9,197210,10,1000000,5,-8311130.882424837,4937777.5703156255
IN THE LIFE MINISTRIES,1447 FERRIS PL 2ND FLR,BRONX,NY,10461,3,200908,10,0,1,-8220083.895419419,4988752.169462129
CITY OF REFUGE RESTORATION AND HEALING CENTER,219 HOBSON AVE,FAYETTEVILLE,NY,13066,3,200608,10,0,1,-8466730.038390439,5316410.1317741005
FRANCISCAN HANDMAIDS OF MARY FOUNDATION INC,15 W 124TH ST,NEW YORK,NY,10027,3,201409,15,0,1,-8231365.123935899,4983788.831447622
GLORY TABERNACLE INC,PO BOX 554,SELDEN,NY,11784,9,199207,10,1000000,1,-8131972.959983672,4992004.716648319
HEALING TAO SOCIETY,1 UNION SQ W STE 715,NEW YORK,NY,10003,3,200709,15,0,1,-8236708.014216014,4973386.662544388
ISLAMIC CENTER OF FIVE TOWNS INC,437 HAMILTON AVE,HEWLETT,NY,11557,3,200902,10,0,1,-8204953.461550288,4959782.721427605
BETHANY CONGREGATIONAL CHURCH,115 MAIN ST,MONTPELIER,VT,5602,3,195101,10,1000000,1,-8078954.158186611,5505916.645643149
COMMUNITY LUTHERAN CHURCH,1560 WILLISTON RD,S BURLINGTON,VT,5403,9,194107,10,1029000,5,-8144362.707989469,5537668.488411549
ZION EPISCOPAL CHURCH,PO BOX 717,MANCHESTR CTR,VT,5255,9,194001,10,0,5,-8132228.994812495,5338208.290563486
CHAPEL OF THE SNOWS,PO BOX 367,S LONDONDERRY,VT,5155,3,196304,15,1029000,1,-8105769.910323805,5340931.148433594
PROTESTANT EPISCOPAL CHURCH IN THE UNITED STATES OF AMERICA,33 FAIRGROUND RD,SPRINGFIELD,VT,5156,9,194001,10,0,5,-8070688.574675718,5358653.132236219
FIRST UNITED METHODIST CHURCH,18 TOWN CRIER DR,BRATTLEBORO,VT,5301,9,197410,10,1919000,5,-8076977.680627579,5292267.075291884
LYNDONVILLE UNITED METHODIST CHURCH,PO BOX 543,LYNDONVILLE,VT,5851,9,197410,10,1919000,5,-8015176.550243365,5547753.005804689
ST JAMES EPISCOPAL CHURCH,2 ST. JAMES PL,WOODSTOCK,VT,5091,9,194001,10,0,5,-8073066.692957535,5407250.274648655
NORTH SPRINGFIELD BAPTIST CHURCH,PO BOX 23,N SPRINGFIELD,VT,5150,9,195504,10,1000000,5,-8074175.769044313,5363846.674455032
FIRST BAPTIST CHURCH,TOWN HALL,SOUTH LONDONDERRY,VT,5155,9,195504,10,1000000,5,-8105769.910323805,5340931.148433594
EAST RANDOLPH BAPTIST CHURCH,PO BOX 216,EAST RANDOLPH,VT,5041,3,199201,10,1000000,1,-8076550.102463439,5457966.821286051
ADVENT CHRISTIAN CHURCH,4554 FORT BRIDGMAN RD,VERNON,VT,5354,9,195809,10,0,1,-8066844.935297612,5270652.03900144
FIRST BAPTIST CHURCH,9 CHURCH ST,BELLOWS FALLS,VT,5101,9,195504,10,1000000,5,-8064506.558074009,5332274.068188398
PROTESTANT EPISCOPAL CHURCH IN THE UNITED STATES OF AMERICA,7 EAST WELLS ROAD,WELLS,VT,5774,9,194001,10,0,5,-8148977.902758271,5375681.273063535
PROTESTANT EPISCOPAL CHURCH IN THE UNITED STATES OF AMERICA,4 ST JAMES PL,ESSEX JCT,VT,5452,9,194001,10,0,5,-8139174.663121049,5542824.4495968
PROTESTANT EPISCOPAL CHURCH IN THE UNITED STATES OF AMERICA,15 SUMMER ST,RANDOLPH,VT,5060,9,194001,10,0,5,-8089261.7864366155,5453777.8640025295
DISCALCED CARMELITE NUNS OF THE DIOCESE OF BURLINGTON VERMONT,139 DEPUYSTER AVE,BEACON,NY,12508,9,194603,10,1150120,5,-8232280.170150219,5086929.849818888
ST PAUL EVANGELICAL LUTHERAN CHURCH,6 GIBBS ST,PROCTOR,VT,5765,9,198804,10,1000000,1,-8130661.393743141,5413051.9838409135
NORTHFIELD UNITED METHODIST PARISH,152 S MAIN ST,NORTHFIELD,VT,5663,9,197410,10,0,5,-8088074.4527478125,5488169.380775924
PROTESTANT EPISCOPAL CHURCH IN THE UNITED STATES OF AMERICA,1265 MAIN ST,ST JOHNSBURY,VT,5819,9,194001,10,0,5,-8017293.512999782,5530630.134145113
HALIFAX UNION SOCIETY INC,PO BOX 1004,JACKSONVILLE,VT,5342,3,200912,10,0,1,-8106309.698534659,5280697.445236815
PROTESTANT EPISCOPAL CHURCH IN THE UNITED STATES OF AMERICA,PO BOX 383,BETHEL,VT,5032,9,194001,10,0,5,-8085375.845652006,5438515.9188910555
CHRISTADELPHIAN ECCLESIA OF SPRINGFIELD VT,27 DELPHIAN RD,SPRINGFIELD,VT,5156,3,195209,10,1279265,1,-8067758.200400077,5351165.466910824
FIRST CONGREGATIONAL CHURCH OF MIDDLETOWN SPRINGS VT INC,TOWN SQUARE,MIDDLETOWN SPRINGS,VT,5757,3,198301,10,3001000,1,-8139080.598151332,5386216.158018597
RUTLAND CITY BAND,18 SONIA DR,RUTLAND,VT,5701,0,0,10,0,0,-8120536.552097024,5404460.548650916
PROTESTANT EPISCOPAL CHURCH IN THE UNITED STATES OF AMERICA,PO BOX 725,WINDSOR,VT,5089,9,194001,10,0,5,-8058336.89793577,5385377.246779174
ROMAN CATHOLIC DIOCESE BURLINGTON,PO BOX 3,UNDERHILL CTR,VT,5490,9,194603,10,0,0,-8115404.834890943,5544275.68520704
ST JOHNS IN THE MOUNTAINS,PO BOX 1175,STOWE,VT,5672,9,194001,10,0,5,-8092039.875648855,5536784.906927482
PEACHAM CONGREGATIONAL CHURCH,PO BOX 205,PEACHAM,VT,5862,3,200605,10,0,1,-8039173.915512654,5516372.852773041
UNITED CHURCH OF HARDWICK,PO BOX 396,HARDWICK,VT,5843,9,195504,10,1000000,5,-8056077.334911652,5542792.611788639
HYDEVILLE BAPTIST CHURCH,1044 RTE 4A W,HYDEVILLE,VT,5750,9,197203,10,1000000,5,-8151602.03711474,5404817.212721951
FIRST UNITED METHODIST CHURCH,PO BOX 365,SHELBURNE,VT,5482,9,197410,10,1919000,5,-8151488.602553618,5522928.337684472
VALLEY BIBLE CHURCH,851 FAIRVIEW TER,WHITE RIV JCT,VT,5001,3,196611,10,1000000,1,-8051781.51576194,5410888.915386853
CATHOLIC DAUGHTERS OF THE AMERICAS,18 CAIN ST,PROCTOR,VT,5765,9,197201,10,36601279,5,-8131330.089924337,5412915.652034661
CHRISTIAN LIFE CHURCH,272 LINCOLN BLVD,MIDDLESEX,NJ,8846,9,196408,10,1002029,5,-8294006.939114582,4948321.021282473
IGLESIA CRISTIANA SHALOMIR A NJ NONPROFIT CORPORATION,128 EDGAR ST,CARTERET,NJ,7008,3,201601,10,0,1,-8262741.079013439,4951194.13131563
DELIVERANCE REVIVAL TABERNACLE OF VERMONT,R F D,BELLOWS FALLS,VT,5101,3,196401,10,1000000,5,-8064955.954858338,5331918.958576426
SUN OF JUSTICE TRUST,LOCAL,BENSON,VT,5731,3,196802,10,602029000,2,-8160925.601066131,5420183.588478564
OLD GOSHEN CHURCH,LOCAL,BRADFORD,VT,5033,3,197812,10,1062119,5,-8029163.398983578,5464479.829183121
NORTH FERRISBURG UMC,PO BOX 7,N FERRISBURGH,VT,5473,9,197410,10,1919000,5,-8151674.8400617195,5505036.4449126255
FAITH REMMANT CHRISTIAN MINISTRIES INC,PO BOX 15286,JERSEY CITY,NJ,7305,3,200608,10,0,1,-8247310.527797126,4969075.90758802
NEW LIFE FELLOWSHIP,PO BOX 187,NO SCITUATE,RI,2857,3,197911,10,1000000,5,-7968527.672348485,5135726.11969271
PROTESTANT EPISCOPAL CHURCH IN THE UNITED STATES OF AMERICA,PO BOX 25,ARLINGTON,VT,5250,9,194001,10,0,5,-8143746.888566399,5322618.922803527
LAUREL PARK ASSOCIATION,2 LAUREL PARK,NORTHAMPTON,MA,1060,3,195309,16,29000000,5,-8086497.166882765,5214807.742417521
OLD SOUTH CHURCH IN BOSTON,645 BOYLSTON ST,BOSTON,MA,2116,3,194901,10,1000000,1,-7912388.919182965,5213534.112720113
FIRST CHURCH OF CHRIST,PO BOX 66,LANCASTER,MA,1523,3,199409,10,1000000,1,-7978978.568783139,5227269.281216302
HELLENIC ORTHODOX CHURCH OF LOWELL,62 LEWIS ST,LOWELL,MA,1854,3,196512,10,1000000,1,-7938972.792820828,5258192.118197474
FIRST BAPTIST CHURCH,131 MAIN ST,NORTH ADAMS,MA,1247,9,195504,10,1000000,5,-8138540.809940471,5266223.693466335
CHRIST CHURCH CAMBRIDGE,0 GARDEN ST,CAMBRIDGE,MA,2138,3,194207,10,1000000,1,-7917780.790039026,5218371.502076582
CISTERCIAN ABBEY OF SPENCER INC,167 N SPENCER RD,SPENCER,MA,1562,9,194603,10,1000000,5,-8014976.286479433,5204925.6750255795
CONGREGATION MISHKAN TEFILA,300 HAMMOND POND PKWY,CHESTNUT HILL,MA,2467,3,195211,10,1000000,5,-7923319.491303446,5209695.581077156
CONGREGATION ADATH ISRAEL TEMPLE ISRAEL,477 LONGWOOD AVE,BOSTON,MA,2215,3,194012,10,1000000,1,-7915885.575708271,5212089.718191217
CONGREGATION TEMPLE EMANUEL OF ANDOVER MASSACHUSETTS,7 HAGGETTS POND RD,ANDOVER,MA,1810,3,195511,10,0,5,-7926050.158412602,5257396.4044867
FOREST HILLS COVENANT CHURCH-BOSTON MA,455 ARBORWAY,JAMAICA PLAIN,MA,2130,9,197507,10,1000000,5,-7915925.762044448,5206211.5430602385
FIRST BAPTIST CHURCH,34 OAKLAND ST,MEDFORD,MA,2155,9,195504,10,1000000,5,-7915463.897477147,5224083.669855785
FIRST CHURCH IN CAMBRIDGE CONGREGATIONAL UCC,11 GARDEN ST,CAMBRIDGE,MA,2138,9,196406,10,0,5,-7917323.266931863,5217605.207619177
FIRST BAPTIST CHURCH,111 PARK AVE,WORCESTER,MA,1609,9,195504,10,1000000,5,-7993835.935941353,5202570.508677611
DIOCESE OF WESTERN MASS CORP,37 CHESTNUT ST,SPRINGFIELD,MA,1103,9,194001,10,1000000,5,-8080248.4699060675,5176445.459617547
FIRST CONGREGATIONAL CHURCH,165 MAIN ST,AMHERST,MA,1002,9,196406,10,1029000,5,-8072481.041116476,5217441.55867315
FIRST BAPTIST CHURCH,228 N MAIN ST,FALL RIVER,MA,2720,9,195504,10,1000000,5,-7920935.918366581,5116886.725399248
FIRST CALVARY BAPTIST CHURCH,586 MASSACHUSETTS AVE,NORTH ANDOVER,MA,1845,9,195504,10,1000000,5,-7917260.4827390555,5264583.421447271
FISK MEMORIAL UNITED METHODIST CHURCH,106 WALNUT ST,NATICK,MA,1760,9,197410,10,1919000,5,-7942435.051623484,5205478.287944225
FIRST LUTHERAN CHURCH,1810 NORTHAMPTON ST,HOLYOKE,MA,1040,9,194107,10,1029000,5,-8085248.718793519,5191192.335966412
TRINITY UNITED METHODIST CHURCH,361 SUMNER AVE,SPRINGFIELD,MA,1108,9,197410,10,1919000,5,-8077664.633205264,5173750.997195534
EPISCOPAL CHAPLAINCY AT HARVARD AND RADCLIFFE,2 GARDEN ST,CAMBRIDGE,MA,2138,3,194111,15,29059349,1,-7917122.780528944,5217444.7231287
ABC OF MASSACHUSETTS,167 PRESCOTT ST,GROTON,MA,1450,9,195504,10,1000000,5,-7962743.288967884,5250865.255295514
PROTESTANT EPISCOPAL CHURCH IN THE US OF AMERICAN EPISCOPAL CHURCH,1135 WALNUT ST,NEWTON,MA,2461,9,199401,10,0,1,-7926732.1016132,5209436.913763642
JEWISH COMMUNITY CENTER INC OF FITCHBURG AND LEOMINSTER,268 WASHINGTON ST,LEOMINSTER,MA,1453,3,194811,15,59029000,1,-7988351.447268947,5241989.037773344
SERVANTS OF RELIEF FOR INCURABLE CANCER INC,1600 BAY ST,FALL RIVER,MA,2724,3,194107,15,150000000,1,-7924604.340866178,5113332.254566884
UNITED HEBREW SCHOOLS COOP,594 CONVERSE ST,LONGMEADOW,MA,1106,3,196011,11,46029000,1,-8077029.666829782,5170951.730647799
HAMPSHIRE REGIONAL YOUNG MENS CHRISTIAN ASSOCIATION,286 PROSPECT ST,NORTHAMPTON,MA,1060,3,195508,15,325399328,1,-8086723.924685514,5210452.351509407
WELLESLEY FRIENDLY AID ASSOCIATION,219 WASHINGTON ST,WELLESLEY HLS,MA,2481,9,197410,10,1919000,5,-7933929.018012479,5208222.717188969
SOUTH CHURCH IN ANDOVER,41 CENTRAL ST,ANDOVER,MA,1810,9,196406,10,0,5,-7919557.671751068,5259400.042680989
BENEVOLENT FRATERNITY OF UNITARIAN CHURCH,10 PUTNAM ST,ROXBURY,MA,2119,3,199101,10,1000000,1,-7913592.39419793,5210477.19676874
CHURCH OF THE BLESSED SACRAMENT,10 DIAMOND ST,WALPOLE,MA,2081,9,194603,10,0,5,-7931094.6011379,5182970.47732762
CATHEDRAL HIGH SCHOOL,74 UNION PARK ST,BOSTON,MA,2118,9,194603,11,0,5,-7911267.37531322,5212153.272940991
BOSTON SOCIETY OF REDEMPTORIST FATHERS,1545 TREMONT ST,ROXBURY,MA,2120,9,194603,10,0,5,-7914887.262514832,5210957.250089552
OUR LADY OF VICTORIES CHURCH,27 ISABELLA ST,BOSTON,MA,2116,9,194603,10,0,5,-7911548.679666453,5213368.576036967
SACRED HEART,311 RIVER ST,WALTHAM,MA,2453,9,194603,10,0,1,-7929061.127999581,5217069.817853934
SAINT FRANCIS OF ASSISI PARISH,114 HIGH ST,MEDFORD,MA,2155,9,194603,10,31150120,5,-7916285.7692776695,5223980.979575534
SAINT GREGORYS PARISH,2223 DORCHESTER AVE,DORCHESTER,MA,2124,9,194603,10,0,5,-7911200.806257728,5202169.261833684
ST AGNES PARISH,51 MEDFORD ST,ARLINGTON,MA,2474,9,194603,10,0,5,-7920229.596197496,5223549.57194807
SAINT JAMES PARISH,6 COTTAGE ST,HAVERHILL,MA,1830,9,194603,10,31150120,5,-7912995.610407788,5278304.635031571
ST PATRICKS PARISH,44 E CENTRAL ST,NATICK,MA,1760,9,194603,10,31150120,5,-7941955.153298671,5203686.777362035
SAINT PATRICKS PARISH,118 S BROADWAY,LAWRENCE,MA,1843,9,194603,10,31150120,5,-7921846.734440248,5265921.970995136
SAINT MICHAEL PARISH,20 HIGH ST,HUDSON,MA,1749,9,194603,10,31150120,5,-7966357.387555979,5220026.668769653
CHURCH OF THE ASCENSION,160 ROCK ST,FALL RIVER,MA,2720,9,197206,10,1000000,5,-7920696.470141881,5116711.2294713585
FIRST BAPTIST CHURCH,5 SWAIN PL,WAKEFIELD,MA,1880,9,195504,10,1000000,5,-7911231.085159224,5237637.86999726
ST ANTHONYS PARISH,43 HOLTON ST,ALLSTON,MA,2134,9,194603,10,31150120,5,-7918763.741142729,5215046.670634957
ST LUKES CHURCH,70 W MAIN ST,WESTBOROUGH,MA,1581,9,194603,10,0,5,-7972313.202952398,5200976.905161498
PLYMOUTH CHURCH IN FRAMINGHAM UCC,87 EDGELL RD,FRAMINGHAM,MA,1701,9,196406,10,1029000,5,-7951977.247054791,5206549.443464414
COUNCIL OF CHURCHES OF GREATER SPRINGFIELD INC,39 OAKLAND ST,SPRINGFIELD,MA,1108,3,197509,10,2006029,1,-8077753.911436883,5173909.844450329
SACRED HEART OF JESUS PARISH,49 6TH ST,CAMBRIDGE,MA,2141,9,194603,10,31150120,5,-7913156.6897109635,5216642.34149684
CATHEDRAL OF THE HOLY CROSS,1400 WASHINGTON ST,BOSTON,MA,2118,9,194603,10,31150120,5,-7911487.565266009,5212207.490600224
ST CLEMENTS PARISH,71 WARNER ST,MEDFORD,MA,2155,9,194603,10,0,5,-7916376.160704193,5221484.184689479
OPEN CHURCH FOUNDATION,PO BOX 81389,WELLESLEY HLS,MA,2481,3,194309,2,29000000,1,-7932249.20689641,5209090.027592489
CALVARY BAPTIST CHURCH,60 HASTINGS ST,LOWELL,MA,1851,9,195504,10,1000000,5,-7940084.985853346,5256297.22555641
FIRST PARISH CONGREGATIONAL CHURCH,1 CHURCH ST,WAKEFIELD,MA,1880,3,201407,10,0,1,-7911839.780134875,5237239.663215092
UNITED CHURCH OF NORWOOD,595 WASHINGTON ST,NORWOOD,MA,2062,9,196504,10,59927602,5,-7926002.402351052,5190191.880169662
FIRST CONGREGATIONAL CHURCH OF SOUTH HADLEY,1 CHURCH ST,SOUTH HADLEY,MA,1075,9,196406,10,0,5,-8079050.449546149,5199773.869039392
FIRST BAPTIST CHURCH,90 MOUNT VERNON ST,WINCHESTER,MA,1890,9,195504,10,1000000,5,-7918493.680058064,5229090.004959626
OLD CAMBRIDGE BAPTIST CHURCH,1151 MASSACHUSETTS AVE,CAMBRIDGE,MA,2138,9,195504,10,1000000,5,-7916383.396471094,5216718.4329853235
FIRST BAPTIST CHURCH,493 MAIN ST,MALDEN,MA,2148,9,195504,10,1000000,5,-7911140.5824132105,5225249.380741066
ST JUDES PARISH,PO BOX 305,NORFOLK,MA,2056,9,194603,10,31150120,5,-7940387.218270852,5179369.712049186
TEMPLE EMANUEL OF NEWTON,385 WARD ST,NEWTON CENTRE,MA,2459,3,200906,10,0,1,-7924717.7754273005,5211821.64834811
CONGREGATIONAL CHURCH OF NEEDHAM,1154 GREAT PLAIN AVE,NEEDHAM,MA,2492,9,0,10,1029000,5,-7930469.764836079,5203039.178066425
SALEM COVENANT CHURCH-WORCESTER MA,215 E MOUNTAIN ST,WORCESTER,MA,1606,9,197507,10,1000000,5,-7989963.242176142,5208627.381907221
SISTERS OF CHARITY OF OTTAWA,245 UNIVERSITY AVE,LOWELL,MA,1854,9,194603,10,31150120,5,-7940531.265691936,5259830.670955163
PATRONAGE OF ST JOSEPH PARISH,264 WASHINGTON ST,SOMERVILLE,MA,2143,9,194603,10,0,5,-7914485.176514091,5218005.149825982
MILLBURY FEDERATED CHURCH,20 MAIN ST,MILLBURY,MA,1527,3,196903,10,1000000,1,-7988360.798106176,5189781.991201867
PRESBYTERIAN CHURCH IN NEEDHAM,1458 GREAT PLAIN AVE,NEEDHAM,MA,2492,9,196401,10,1029000,5,-7931823.855122087,5203558.578078807
MOST PRECIOUS BLOOD PARISH,43 MAPLE ST,HYDE PARK,MA,2136,9,194603,10,0,5,-7917313.582136169,5199171.95700397
HELLENIC ORTHODOX COMMUNITY OF HAVERHILL,154 WINTER ST # 156,HAVERHILL,MA,1830,3,196805,10,1000000,1,-7912933.048853961,5278201.503829395
PLEASANT STREET CHRISTIAN REFORMED CHURCH,25 CROSS ST,WHITINSVILLE,MA,1588,9,197502,10,1000000,1,-7977075.228129553,5177665.201916218
SAINT MARY PARISH,176 WASHINGTON ST,E WALPOLE,MA,2032,9,194603,10,31150120,5,-7927800.9913638,5185123.752219478
COMMUNITY BAPTIST CHURCH,31 COLLEGE AVE,SOMERVILLE,MA,2144,9,195504,10,1000000,5,-7917212.837996996,5220742.208818153
ST MATTHEWS PARISH,33 STANTON ST,DORCHESTER,MA,2124,9,194603,10,0,5,-7912565.694534341,5203695.354136513
COMMON STREET SPIRITUAL CENTER,13 COMMON ST,NATICK,MA,1760,9,195504,10,1000000,5,-7942261.615856831,5203436.399154732
FIRST BAPTIST CHURCH,858 GREAT PLAIN AVE,NEEDHAM,MA,2492,9,195504,10,1000000,5,-7929650.453383841,5203052.719420421
FIRST BAPTIST CHURCH,1400 JOHN FITCH HWY,FITCHBURG,MA,1420,9,195504,10,1000000,5,-7992434.200913281,5251357.951502062
SYNAGOGUE COUNCIL OF MASSACHUSETTS INC,1320 CENTRE STREET,NEWTON,MA,2459,3,197402,10,1000000,1,-7925494.228875585,5210319.242260211
ELIOT CHURCH OF NEWTON,474 CENTRE STREET,NEWTON,MA,2458,9,196406,10,0,5,-7924433.354128321,5214221.746029854
THIRD CONGREGATIONAL SOCIETY IN SPRINGFIELD,245 PORTER LAKE DR,SPRINGFIELD,MA,1106,3,195210,10,1000000,1,-8077428.5245652925,5171548.258584965
FIRST BAPTIST CHURCH,217 MAIN ST,HAVERHILL,MA,1830,9,195504,10,1000000,5,-7912295.967408153,5278477.382332554
SECOND CONGREGATIONAL CHURCH OF ATTLEBORO,50 PARK ST,ATTLEBORO,MA,2703,9,0,10,1029000,5,-7935187.373536405,5152705.803898313
FIRST BAPTIST CHURCH OF READING,45 WOBURN ST,READING,MA,1867,9,197204,10,1059349,5,-7915388.088903913,5239904.8126342185
FIRST UNITED BAPTIST CHURCH,99 CHURCH ST,LOWELL,MA,1852,9,195504,10,1000000,5,-7937755.402869518,5257559.990954376
GLOBAL MINISTRIES CHRISTIAN CHURCH,670 WASHINGTON ST,DORCHESTER,MA,2124,3,201401,10,0,1,-7911602.892258471,5204219.605401323
NEW ENGLAND FELLOWSHIP OF EVANGELICALS INC,PO BOX 599,RUMNEY,NH,3266,3,194308,15,29059325,1,-7993854.860254785,5434005.141394191
CONGREGATION CHAI ODOM,77 ENGLEWOOD AVE,BRIGHTON,MA,2135,3,200005,10,0,1,-7920202.990839194,5211738.96991079
ST JAMES ARMENIAN CHURCH,465 MOUNT AUBURN ST,WATERTOWN,MA,2472,9,194909,10,1007029,1,-7921955.604902247,5216689.653756356
CONNEXION,149 BROADWAY,SOMERVILLE,MA,2145,9,197410,10,1919000,5,-7913148.229429666,5219331.981960916
ST THERESAS PARISH,63 WINTER ST,NORTH READING,MA,1864,9,194603,10,31150120,5,-7915791.176780077,5247816.193024377
WORCESTER AREA MISSION SOCIETY UNITED CHURCH OF CHRIST,6 INSTITUTE RD,WORCESTER,MA,1609,3,201502,15,0,1,-7992826.490798839,5201847.9155266145
SAINT ANDREWS PARISH,46 TALBOT AVE,N BILLERICA,MA,1862,9,194603,10,31150120,5,-7935659.034218896,5249253.359924727
SAINT ANTHONY OF PADUA PARISH,400 CARDINAL MEDEIROS AVE,CAMBRIDGE,MA,2141,9,194603,10,31150120,5,-7913568.126548936,5216784.580340692
ST MARGARET MARY PARISH,845 HIGH ST,WESTWOOD,MA,2090,9,194603,10,31150120,5,-7928560.078971522,5194012.000670622
HOLY TRINITY ARMENIAN APOSTLE CHURCH OF GREATER BOSTON,145 BRATTLE ST,CAMBRIDGE,MA,2138,9,194909,10,0,1,-7918255.456347766,5217728.473611097
CONGREGATION OF SISTERS OF ST JOSEPH OF BOSTON,637 CAMBRIDGE ST,BRIGHTON,MA,2135,9,194603,10,0,5,-7919739.45647953,5213760.657148284
FIRST BAPTIST CHURCH,657 BOSTON POST RD,WESTON,MA,2493,9,195504,10,1000000,5,-7938112.40447649,5215977.734720421
FIRST CONGREGATIONAL CHURCH,PO BOX 395,LEE,MA,1238,9,196406,10,0,5,-8154286.395315729,5207055.488785623
FIRST BAPTIST CHURCH,22 MECHANIC ST,MARLBOROUGH,MA,1752,9,195504,10,1000000,5,-7965379.111870883,5213034.9508431
TEMPLE BETH ZION,1566 BEACON ST,BROOKLINE,MA,2446,3,200304,10,0,5,-7918421.545028035,5212017.579548961
PARK STREET BAPTIST CHURCH,FRANKLIN AND PARK STS,FRAMINGHAM,MA,1702,9,195504,10,1000000,5,-7950021.697560028,5202798.8974792445
