NAME,STREET,CITY,STATE,ZIP,AFFILIATION,RULING,FOUNDATION,ACTIVITY,ORGANIZATION,x,y
NEWTON CENTRE MINYAN,47 OXFORD RD,NEWTON,MA,2459,3,198809,10,1029000,1,-7925396.601682159,5209871.894452454
CHABAD LUBARVITCH TORAH CENTER,162 N MAIN ST,SHARON,MA,2067,3,198805,10,0,1,-7922977.517827725,5180739.784588738
CONGREGATION AGUDAS ACHIM ANSHAI SFARD OF NEWTON,PO BOX 600371,NEWTONVILLE,MA,2460,3,198903,10,1000000,1,-7926840.860755709,5213962.653793029
LORDS FAMILY MINISTRIES,35 COPLEY ST,CAMBRIDGE,MA,2138,3,198712,10,1007029,1,-7918699.732435526,5218831.459251055
LUBAVITCH SHUL OF BRIGHTON INC,239 CHESTNUT HILL AVE,BRIGHTON,MA,2135,3,199004,10,1000000,1,-7920956.512472375,5212013.06148944
EVANGELICAL LUTHERAN CHURCH IN AMERICA,2 WOODLAND ST,WORCESTER,MA,1610,9,198704,10,0,1,-7994559.1786730345,5199756.421776165
NEW ENGLAND PENTECOSTAL MINISTRIES,955 BRIDGE ST,PELHAM,NH,3076,3,199101,10,1000000,1,-7935114.793228408,5273356.068897575
IGLESIA DEL SENOR JESUS CRISTO- HECHOS 2-38 INC,791 MAIN STREET 2,WORCESTER,MA,1610,3,198809,10,1007000,1,-7994001.690663144,5199412.8977167215
APPLE VALLEY COMMUNITY CHURCH INC,PO BOX 1149,LEOMINSTER,MA,1453,3,198812,10,1000000,1,-7987689.096298728,5239943.178641096
NEW LIFE COMMUNITY CHURCH,221 BAKER AVE,CONCORD,MA,1742,3,198801,10,1000000,1,-7946491.6451874785,5230040.861191273
WEST SPRINGFIELD CHURCH OF CHRIST,61 UPPER CHURCH ST,W SPRINGFIELD,MA,1089,3,199101,10,1000000,1,-8086108.216581934,5176421.153388993
DHARMA DRUM MOUNTAIN MASSACHUSETTS BUDDHIST ASSOCIATION,319 LOWELL ST,LEXINGTON,MA,2420,3,198805,10,1000000,1,-7925625.474555228,5227967.266829135
PENIEL SPANISH CHRISTIAN CHURCH,41 ENNELL ST,LOWELL,MA,1850,9,196408,10,1002029,5,-7938377.901462032,5259843.839863088
PORTUGUESE CAPE VERDEAN CHRISTIAN ASSOCIATION INC,9 HARVEY ST,NORTON,MA,2766,3,198801,10,2000000,1,-7926412.948633099,5152028.592646263
RESURRECTION LIFE INTERNATIONAL MINISTRIES,PO BOX 1224,NORTHAMPTON,MA,1061,3,198707,10,1000000,1,-8084839.508345365,5209230.647452131
MASSACHUSETTS SATSANG SOCIETY INC,118 WOODLAND ST,WORCESTER,MA,1610,9,197501,10,29000000,5,-7994993.102048147,5198969.072224087
THE NEW ENGLAND CATHOLIC NEWS INCORPORATED,P OBOX319,RAYNHAM,MA,2767,3,201208,15,7008004,1,-7911393.834254763,5153783.454593461
UNITED EMMANUEL HOLINESS CHURCH INC,PO BOX 190227,ROXBURY,MA,2119,3,199803,10,0,1,-7912858.242156148,5209748.1284434935
TEWKSBURY UNITED METHODIST CHURCH,2335 MAIN ST,TEWKSBURY,MA,1876,9,197410,10,0,5,-7928710.248964602,5252007.660285247
GOOD SHEPHERD PENTECOSTAL CHURCH,720 DUDLEY ST,DORCHESTER,MA,2125,9,196408,10,1002029,5,-7911222.402238938,5208764.983892968
LUMBINI BUDDHIST ASSOCIATION INC,79 MARGIN ST,LAWRENCE,MA,1841,3,198810,15,1000000,1,-7923028.613474003,5267011.973952908
AZUSA CHRISTIAN COMMUNITY INC,411 WASHINGTON ST,DORCHESTER,MA,2124,3,199502,10,1000000,1,-7911750.613222755,5205608.770696531
JERUSALEM CAMBODIAN EVANGELICAL CHURCH,825 WELLMAN AVE,N CHELMSFORD,MA,1863,9,197205,10,1000000,5,-7947372.40499864,5258369.036679172
FAITH COMMUNITY CHURCH INC,164 CADY ST,LUDLOW,MA,1056,3,198804,10,1000000,1,-8071160.346677705,5186084.774817406
BERKSHIRE HILLS COMMUNITY CHURCH,202 MCINTOSH DR,PITTSFIELD,MA,1201,3,198906,10,1000000,1,-8147742.479049448,5228808.779877646
MILLERS FALLS MA ZION KOREAN CHURCH OF THE NAZARENE,1193 N PLEASANT ST,AMHERST,MA,1002,9,196307,10,1000000,5,-8074114.6546438625,5222637.965761829
B NAI OR OF BOSTON,PO BOX 400715,CAMBRIDGE,MA,2140,3,198803,10,1004000,1,-7917627.948378167,5219459.189182102
GREATER GRACE CHURCH OF THE BERKSHIRES INC,160 HIGH ST,LEE,MA,1238,3,199008,10,46001030,1,-8154023.569997966,5207305.81209216
ANCHOR BAPTIST CHURCH,29A MONTVALE AVE,WOBURN,MA,1801,3,199008,10,1007029,1,-7920324.440403653,5233072.863701008
HOLY BIBLE BAPTIST CHURCH INC,14 CHAPEL ST,SOMERVILLE,MA,2144,3,199012,10,1000000,1,-7917130.572893299,5220905.764122181
VALLEY LIFE ASSEMBLY OF GOD,PO BOX 371,S DEERFIELD,MA,1373,9,196408,10,1000000,5,-8082750.375461644,5232605.270303908
KOREAN HOPE CHURCH IN BOSTON INC,285 LAKE ST,WALTHAM,MA,2451,3,199408,10,1029000,1,-7931131.670528336,5221805.745744637
NEW HOPE CHAPEL INC,PO BOX 1612,WESTBOROUGH,MA,1581,3,198804,10,1000000,1,-7971937.499670969,5201511.085278076
ARCA DE REFUGIO AIC INC,219 LUDLAM ST,LOWELL,MA,1850,3,198902,10,1000000,1,-7938302.426847274,5260177.306970577
ZION ALLIANCE CHURCH OF BOSTON,400 GREAT RD,BEDFORD,MA,1730,9,199201,10,1000000,5,-7932341.156795801,5233400.253231027
ASSEMBLY OF CHRISTIAN CHURCHES OF FRAMINGHAM,PO BOX 452,FRAMINGHAM,MA,1704,3,198811,10,1000000,1,-7950321.36962924,5202777.081446953
MOVEMENT OF THE LIVING GOD INC,PO BOX 943,FRAMINGHAM,MA,1701,3,198812,10,1000000,1,-7949170.437413929,5206701.464947816
DOUGLAS CAMP MEETING ASSOCIATION,PO BOX 503,DOUGLAS,MA,1516,3,0,10,0,1,-7983332.051429084,5172342.33755808
FAITH FAMILY CHURCH INC,4 BANGOR RD,BOSTON,MA,2132,3,199004,10,1000000,1,-7920584.482734147,5205138.318830089
RIVERS OF LIVING WATER MINISTRIES,37 FLAGG RD,SOUTHBORO,MA,1772,3,199903,10,0,1,-7965262.337725045,5205463.9906353485
CHRISTIAN CUMMUNITY MOVEMENT FOR RELIGIOUS RENEWAL IN THE TACONIC-,PO BOX 204,GT BARRINGTON,MA,1230,3,198904,10,0,5,-8166761.970648927,5190018.035803932
BETHEL AFRICAN METHODIST EPISCOPAL CHURCH,40 WALK HILL ST,JAMAICA PLAIN,MA,2130,9,197505,10,2000000,5,-7916454.084347755,5205153.819591217
NEW CANAAN CHURCH OF GOD IN CHRIST MASSACHUSETTS INC,83 HOWARD AVENUE S2,DORCHESTER,MA,2125,3,199701,10,1029000,1,-7911966.6843543835,5208696.18265027
ST FRANCIS CHURCH,115 WHEELER RD,DRACUT,MA,1826,9,194603,10,31150120,5,-7933411.605019275,5264164.84196923
SAINT JOHN MISSIONARY BAPTIST,230 WARREN ST,BOSTON,MA,2119,3,199510,10,1000000,1,-7912846.21965114,5209477.715879976
LIBERTY CHURCH,PO BOX 195,SHREWSBURY,MA,1545,9,196408,10,1000000,5,-7987005.705944747,5202660.17846021
AGAPE CHRISTIAN LIFE CENTER INC,68 CONCORD AVE,MILTON,MA,2186,3,199001,10,0,1,-7914658.500961254,5199781.239013669
FAITH CHRISTIAN FELLOWSHIP OF CHELMSFORD,105 PRINCETON BLVD,LOWELL,MA,1851,9,198001,10,1006000,5,-7940974.205945803,5256618.007910693
IMMANUEL EVANGELICAL LUTHERAN CHURCH,346 SHREWSBURY ST,HOLDEN,MA,1520,9,198804,10,1000000,1,-7994827.681284826,5211163.252827416
FIRST PENTECOSTAL MISSIONARY CHURCH FOR GOD,633 HYDE PARK AVE,ROSLINDALE,MA,2131,9,199007,10,1002000,1,-7916957.359765626,5202831.997762017
ST GREGORY ARMENIAN CHURCH,135 GOODWIN ST,INDIAN ORCH,MA,1151,9,200311,10,0,1,-8070218.361146612,5184050.657597361
RESURRECTION EVANGELICAL LUTHERAN CHURCH,94 WARREN ST,ROXBURY,MA,2119,9,198704,10,0,5,-7912930.711144655,5210130.272500522
SPIRITUAL ASSEMBLY OF THE BAHAIS OF BOSTON,595 ALBANY ST,BOSTON,MA,2118,9,199505,10,1000000,1,-7911283.516639389,5211632.949801518
LIVING GOD FELLOWSHIP,PO BOX 715,GT BARRINGTON,MA,1230,3,199110,10,1000000,1,-8166761.970648927,5190018.035803932
RANGRIG YESHE INC,PO BOX 6806,SYRACUSE,NY,13217,3,200401,10,3000000,1,-8473768.992432283,5319951.065324317
NEW LIFE RESURRECTION BAPTIST CHURCH,PO BOX 190753,ROXBURY,MA,2119,3,199307,10,1004000,1,-7912858.242156148,5209748.1284434935
NEW TESTAMENT HOUSE OF WORSHIP,PO BOX 191565,BOSTON,MA,2119,3,199206,10,1000000,1,-7912858.242156148,5209748.1284434935
WARREN SDA ELEMENTARY SCHOOL,1570 SOUTHBRIDGE RD,W BROOKFIELD,MA,1585,9,194704,10,211029000,5,-8033114.684309288,5188087.330168897
IFCA NEW ENGLAND DISTRICT,137 WARREN RD,TOWNSEND,MA,1469,9,198512,10,1000000,5,-7979097.680638284,5255496.073957916
FAITH WORSHIP CENTER,2 LOMAR PARK,PEPPERELL,MA,1463,9,196408,10,1002029,5,-7966947.714815652,5262670.283572294
SHALOH SCHOOL OHOLEI TORAH OF STOUGHTON INC,50 ETHYL WAY,STOUGHTON,MA,2072,3,199111,11,46000000,1,-7919219.149179567,5181221.6383549245
ST BONIFACE HAITI FOUNDATION INC,383 ELLIOT ST,NEWTON,MA,2464,3,199203,10,560000000,1,-7928794.851777599,5207927.358987115
CARMEL MAR THOMA CHURCH INC,467 RIVER RD,HUDSON,MA,1749,3,199005,10,0,1,-7970301.659753768,5216528.732769467
CONGREGATIONAL CHURCH OF HOLLAND,11 STURBRIDGE RD,HOLLAND,MA,1521,3,200312,10,0,1,-8033039.766291983,5170833.269266898
INTERFAITH COUNCIL OF FRANKLIN COUNTY INC,PO BOX 1171,GREENFIELD,MA,1302,3,199111,10,2123000,1,-8081558.143715247,5249454.907370263
VIETNAMESE ALLIANCE CHURCH OF BOSTON,67 TEMPLE ST 2,MATTAPAN,MA,2126,9,197205,10,1000000,5,-7911791.022197911,5202158.881094553
IGREJA PRESBITERIANA DE BOSTON,212 SCHOOL ST,SOMERVILLE,MA,2145,3,199306,10,1000000,1,-7914392.6700172415,5219675.927700084
IGL DEL DIOS VIVIENTE ASAMBLEAS DE DIOS,117 MYRTLE AVE,FITCHBURG,MA,1420,9,196408,10,1002029,5,-7991640.158985457,5249179.878582319
NEW BEGINNINGS FELLOWSHIP CHURCH,167 CHAPEL ST,LEICESTER,MA,1524,3,199111,10,1007000,1,-8002614.145707346,5198682.273640947
CENTRO CRISTIANO BETESDA,136 GRAND ST,WORCESTER,MA,1603,3,200305,10,0,1,-7994490.383227727,5197974.262665476
SPIRITUAL ASSEMBLY OF THE BAHAIS OF SPRINGFIELD,PO BOX 81196,SPRINGFIELD,MA,1138,9,199505,10,1000000,1,-8077697.583774539,5174107.544737416
PLEASANT HILL BAPTIST CHURCH,155 HUMBOLDT AVE,DORCHESTER,MA,2121,9,195504,10,1000000,5,-7913536.400494057,5208198.0283831535
PEPPERELL CHRISTIAN FELLOWSHIP,PO BOX 192,PEPPERELL,MA,1463,3,199709,10,1000000,1,-7966903.52097781,5261525.5245772395
BAHAIS OF GREENFIELD TOWN,6 LINCOLN ST,GREENFIELD,MA,1301,9,199505,10,1000000,1,-8080955.237353113,5251525.51642624
SPIRITUAL ASSEMBLY OF THE BAHAIS OF NEWTON,97 SACO ST,NEWTON U F,MA,2464,9,199505,10,1000000,1,-7928380.186674397,5207182.2301263595
SPIRITUAL ASSEMBLY OF THE BAHAIS OF AMHERST TOWN,PO BOX 2118,AMHERST,MA,1004,9,196506,10,0,1,-8072820.565563393,5217736.761724398
GREATER FRIENDSHIP MISSIONARY BAPTIST CHURCH,111 HARVARD ST,DORCHESTER,MA,2124,3,199906,10,0,1,-7912435.450730113,5205537.734880795
RIVERS OF LIVING WATER INTERNATIONAL MINISTRY - MIRAV,204 MAIN ST,MARLBOROUGH,MA,1752,3,199503,10,1000000,1,-7964924.037792523,5213036.457025231
BAHAIS OF LOWELL,1345 PAWTUCKET BLVD,LOWELL,MA,1854,9,199505,10,1000000,1,-7945707.622013828,5258388.559965955
SPIRITUAL ASSEMBLY OF THE BAHAIS OF HOLYOKE,5 MAPLE CREST CIR,HOLYOKE,MA,1040,9,199505,10,1000000,1,-8086704.666413604,5191225.996870905
GRACE CHURCH INC,148 L ST,TURNERS FALLS,MA,1376,3,199301,10,1007000,1,-8077090.6699107345,5251916.159945971
SPIRITUAL ASSEMBLY OF THE BAHAIS OF MARLBOROUGH,62 NEWTON ST,MARLBOROUGH,MA,1752,9,199505,10,1000000,1,-7964861.364919207,5212745.467085137
GREATER FAITH WORSHIP CENTER INC,PO BOX 2158,JAMAICA PLAIN,MA,2130,3,199107,10,1029005,1,-7915952.478722233,5208691.81672394
SPIRITUAL ASSEMBLY OF THE BAHAIS OF BELCHERTOWN TOWN,91 GULF RD,BELCHERTOWN,MA,1007,9,196506,10,0,1,-8064760.700471487,5211001.973987366
FAMILY COVENANT BIBLE CHURCH,PO BOX 245,GRAVILLE,MA,1034,3,199102,10,1029000,1,-8126368.691539176,5170566.061792445
ST ASDVADZADZIN ARMENIAN APOSTOLIC CHURCH,315 CHURCH ST,WHITINSVILLE,MA,1588,9,200311,10,0,1,-7976515.7363688275,5178220.432278324
SET FREE MINISTRIES INC,PO BOX 124,EASTON,MA,2334,3,199608,10,1000000,1,-7916669.4875624385,5164943.848161463
LAWRENCE STREET PM CHURCH,1199 LAWRENCE ST,LOWELL,MA,1852,9,196806,10,1000000,5,-7936045.869449407,5254890.149034486
GANESH HINDU TEMPLE INC,16 COUNTRYSIDE DR,MATTAPAN,MA,2126,3,199102,10,1000000,1,-7912287.284487868,5202477.680282664
WACHUSETT HILLS CHRISTIAN SCHOOL,100 COLONY RD,WESTMINSTER,MA,1473,9,194704,10,211029000,5,-8008743.174231445,5246774.210181651
IGLESIA BAUTISTA LA NUEVA JERUSALEM,134 ABBE AVE,SPRINGFIELD,MA,1107,3,199908,10,0,1,-8083459.703256979,5179022.2721383115
CONGREGATION BETH-EL OF FALL RIVER SPECIAL PROJECT FUND TRUST,385 HIGH ST,FALL RIVER,MA,2720,3,199109,17,927000000,2,-7920492.866793223,5117081.161342559
ST NICHOLAS RUSSIAN ORTHODOX CHURCH,1304 NORTH ST,PITTSFIELD,MA,1201,9,197210,10,1000000,5,-8153699.296321281,5233193.614627138
CHRISTIAN LIFE MINISTRIES OF THE ASSEMBLIES OF GOD,PO BOX 1388,LEOMINSTER,MA,1453,9,196408,10,1002029,5,-7987689.096298728,5239943.178641096
GREENDALE AVENUE WORSHIP CENTER INC,PO BOX 321,NEEDHAM,MA,2494,3,199208,17,29000000,1,-7929846.264368146,5205014.313653713
BANGLADESH ISLAMIC SOCIETY OF NEW ENGLAND INC,114 YORKTOWN ST,SOMERVILLE,MA,2144,3,201308,10,29000000,1,-7918025.247640804,5221180.121305438
SUNG KWANG PRESBYTERIAN CHURCH,10 CAROUSEL LN,LUNENBURG,MA,1462,3,199402,10,1000000,1,-7986784.848075014,5247763.584717796
BHUDDIST ASSOCIATION OF WORCESTER COUNTY INC,16 RUTHVEN AVE,WORCESTER,MA,1606,3,199405,10,0,1,-7993191.396089655,5204580.157828168
IGLESIA DE AVIVAMIENTO FUENTE DE VIDA,23 CORAL ST,WORCESTER,MA,1604,3,200310,10,0,1,-7991817.156975814,5199420.267410517
ORDER OF THE FRIARS MINOR SOCIETY OF THE FRANCISCAN CENTER,459 RIVER RD,ANDOVER,MA,1810,9,194603,10,31150120,5,-7931037.382919631,5259674.461866604
CHINESE BIBLE CHURCH OF GREATER LOWELL,197 LITTLETON RD BLDG A,CHELMSFORD,MA,1824,3,199106,10,1000000,1,-7945577.044251127,5249504.0474984925
IGLESIA PENTECOSTAL HEROES DE LA FE OF ATTLEBORO INC,40 JAMES ST,ATTLEBORO,MA,2703,3,199701,10,1000000,1,-7934793.859136451,5151752.633489406
JITA MINISTRIES,PO BOX 534,TYNGSBORO,MA,1879,3,199205,10,1000000,5,-7946615.209822264,5264162.116114709
NATIONAL SPIRITUALIST ASSOCIATION OF CHURCHES,465 GRANDBY RD,CHICOPEE,MA,1020,9,194704,15,0,5,-8079348.4518230045,5183849.296919863
UNITED CHURCH OF CLINTON,109 HASKELL AVE,CLINTON,MA,1510,3,199106,10,1029000,1,-7978784.09363272,5223683.772141842
CATHOLIC ENGAGED ENCOUNTER OF BOSTON INC,43 CYNTHIA LN,ATTLEBORO,MA,2703,3,199105,16,563029123,1,-7944860.48068889,5147867.753950251
ANTIOCH BAPTIST CHURCH,PO BOX 382071,CAMBRIDGE,MA,2238,3,201209,10,0,1,-7917358.443890953,5217108.241947797
HOUSE OF GOD WHICH IS THE CHURCH OF THE LIVING GOD PILLAR AND GROUND O,22 KING ST,SPRINGFIELD,MA,1109,3,199901,10,0,1,-8078536.710096139,5176644.562975821
NATIONAL SPIRITUALIST ASSOCIATION OF CHURCHES,58 E BROADWAY,DERRY,NH,3038,9,194704,15,29000000,5,-7939592.73106506,5294156.628144671
DHARMALAYA INC,2353 MASS AVE APT 66,CAMBRIDGE,MA,2140,3,201403,10,1029994,1,-7918047.511538963,5220540.21815203
OPEN DOOR MINISTRIES,PO BOX 87,CHARLTON DEPT,MA,1509,3,199603,10,1000000,1,-8030242.084849369,5196679.587409775
CENTRO DE FAMILIA Y ADORACION,PO BOX 758,MILFORD,MA,1757,9,196408,10,1002029,5,-7961625.529960829,5182035.891622916
ASAMBLEA DE IGLESIAS CRISTIANAS INC,PO BOX 184,HOLYOKE,MA,1041,3,199510,10,1000000,1,-8086236.901913289,5186043.3222353505
GRACE BIBLE CHURCH,PO BOX 3519,CRANSTON,RI,2910,3,199208,10,1029000,5,-7952047.823611953,5127862.424808909
SHAWMUT COMMUNITY CHURCH OF GOD,PO BOX 190782,BOSTON,MA,2119,9,196007,10,0,1,-7912858.242156148,5209748.1284434935
GOOD SAMARITAN BAPTIST CHURCH,407R MYSTIC AVE STE 36D,MEDFORD,MA,2155,3,199203,10,1000000,1,-7914524.917572304,5221280.670683378
ASSEMBLY OF REHOBOTH CHRISTIAN CHURCH INC,29 SPRUCE ST,MILFORD,MA,1757,3,199812,10,0,1,-7961402.445701279,5182338.251946766
CHRIST TEMPLE CHURCH OF PERSONAL EXPERIENCE,28-30 KENILWORTH ST,ROXBURY,MA,2119,3,199809,10,1000000,1,-7913409.830233027,5210339.268758473
GRACE COMMUNITY CHURCH OF GOD IN CHRIST,31 BLITHEWOOD TER,WORCESTER,MA,1604,3,199201,10,1000000,1,-7988912.608822036,5196641.546778444
CHRIST LUTHERAN CHURCH OF SOUTHWICK COUNTY OF HAMPDEN,569 COLLEGE HWY,SOUTHWICK,MA,1077,9,200802,10,0,1,-8100297.555475895,5170058.058388365
HAVURAH OR HADASH INC,15 HARRINGTON ST,NEWTON,MA,2460,3,199211,16,998000000,1,-7927651.600607154,5213813.227075718
NEW LIFE FELLOWSHIP BAPTIST CHURCH INC,39 FORDHAM RD,ALLSTON,MA,2134,3,199706,10,1029000,1,-7917922.388431312,5213814.5827510655
BAHAIS OF WESTFORD TOWN,80 POWER RD,WESTFORD,MA,1886,9,199505,10,1000000,1,-7953013.520194589,5242225.632543248
SPIRITUAL ASSEMBLY OF THE BAHAIS OF SOMERVILLE,51 HEATH ST UNIT 3,SOMERVILLE,MA,2145,9,199505,10,1000000,1,-7914220.12480651,5220285.9270806955
THE SUPREME MASTER CHING HAI INTL ASSOCIATION,128 PROVIDENCE STREET,WORCESTER,MA,1604,9,199208,10,1000000,1,-7991894.190063446,5198236.076199806
OR ATID CONSERVATIVE JEWISH ASSOCIATION,97 CONCORD RD,WAYLAND,MA,1778,3,199302,10,1029000,1,-7943621.494756357,5217648.154634591
DORCHESTER MA AMIS DE LA SAGESSE CHURCH OF THE NAZARENE,130 RIVER ST,MATTAPAN,MA,2126,9,196307,10,1000000,5,-7912213.145706997,5201733.280575028
UNITED METHODIST FOUNDATION OF NEW ENGLAND,16 ROUTE 111 STE 3 STE 102,DERRY,NH,3038,9,197106,10,1002000,5,-7927242.946756452,5289600.110509167
CHRIST APOSTIC CHURCH MT ZION,64 MCLELLAN STREET 2ND FLOOR,BOSTON,MA,2121,3,199210,10,1029000,1,-7912989.153877319,5205948.004159074
GREATER LIFE BAPTIST CHURCH,660 WASHINGTON ST,DORCHESTER,MA,2124,3,199603,10,1006007,1,-7911598.105520367,5204319.824357442
ST MARYS INDIAN ORTHODOX CHURCH OF BOSTON,65 GREAT RD,MAYNARD,MA,1754,3,199805,10,1000000,1,-7955700.884021828,5225338.059068904
IGLESIA DE DIOS PENTECOSTAL EL SINAI,74 OAK ST,SPRINGFIELD,MA,1109,3,199603,10,1000000,1,-8078875.789265093,5177001.6691148225
PORTUGUESE CHRISTIAN CHURCH INC,PO BOX 492,FALL RIVER,MA,2722,3,199202,10,1007029,1,-7920896.511266837,5116401.845578584
THE GREAT FEAST OF THE HOLY GHOST OF NEW ENGLAND,PO BOX 1054,FALL RIVER,MA,2722,3,200008,15,0,1,-7920896.511266837,5116401.845578584
AGAWAM CHURCH OF THE BIBLE,335 WALNUT ST EXT,AGAWAM,MA,1001,3,200302,10,0,1,-8085042.109818603,5174259.0477372445
NEW HOPE CHRISTIAN CHURCH INC,195 ALMIRA RD,SPRINGFIELD,MA,1119,3,199304,10,1029000,1,-8072833.367304834,5180595.533429067
CHURCH OF THE GOOD SHEPHARD PRESBYTERIAN,701 FOUNDRY ST,SOUTH EASTON,MA,2375,9,196401,10,1029000,1,-7919823.836653554,5162658.1963347895
BUDDHIST PRACTICE INC,PO BOX 1350,LITTLETON,MA,1460,3,199204,10,1000000,1,-7955970.277189545,5242228.200973683
SOVEREIGN GRACE CHAPEL,449 MAIN ST,SOUTHBRIDGE,MA,1550,3,199204,10,1002000,1,-8019106.907504808,5172563.101781729
TEMPLE SHIRTIKVAH INC OF WINCHESTER,34 VINE ST,WINCHESTER,MA,1890,3,199208,10,1029000,1,-7919150.799012221,5229194.561268721
INTERNATIONAL GOSPEL PARTY,BOX 705,ROXBURY,MA,2258,3,199411,10,1000000,1,-7913046.594734569,5210350.11018873
BOSTON CENTRAL KOREAN EVANGELICAL CHURCH INC,421 COMMON ST,BELMONT,MA,2478,3,199306,10,1029000,1,-7923181.0098569,5218410.082160063
READING CLERGY ASSOCIATION,300 HAVERHILL ST ST ANTHANOSIUS CH,READING,MA,1867,3,199303,10,2000000,5,-7913494.989643485,5242124.255641357
BAPTIST CHURCH OF GRAFTON INC,PO BOX 304,GRAFTON,MA,1519,9,195504,10,1000000,5,-7980568.656389628,5191519.633214777
BIBLE TRUTH LIFELINE CHURCH MINISTRIES INC,30 BELDEN ST,DORCHESTER,MA,2125,3,199301,10,1029000,1,-7910975.161649891,5208828.516337616
SONS OF GOD APOSTOLIC SPIRITUAL BAPTIST CHURCH INC BETHANY APOSTOL,8 RUSSELL RD,WAYLAND,MA,1778,3,200207,10,0,1,-7945660.867827692,5210870.061683814
CHINESE CHRISTIAN CHURCH OF PRAISE AND WORSHIP CORP,89 UNION PARK ST APT 306,BOSTON,MA,2118,3,199211,10,1006029,1,-7911197.911950963,5212113.362917965
OPERATION BEACON STREET INC,28 WELLESLEY RD,NATICK,MA,1760,3,199212,10,1006007,1,-7940607.185584662,5206913.24547556
BETHEL PENTECOSTAL CHURCH UNITED HOLY CHURCH OF AMERICA NEW ENGLAND,112 HUMBOLDT AVE,DORCHESTER,MA,2121,3,199711,10,1002000,1,-7913349.049791057,5208500.922326032
DZOGCHEN FOUNDATION,PO BOX 734,CAMBRIDGE,MA,2140,3,199306,10,200000000,1,-7917627.948378167,5219459.189182102
MOTHER CAROLINE ACADEMY AND EDUCATION CENTER,515 BLUE HILL AVE,DORCHESTER,MA,2121,3,199403,11,46000000,1,-7913042.141954936,5207144.147336317
PENTECOSTAL CHURCH REFUGE OF SALVATION INC,PO BOX 70205,SPRINGFIELD,MA,1107,3,199303,10,1000000,1,-8082330.812300848,5178629.072518557
CLINICAL PASTORAL EDUCATION,319 CONCORD RD,WESTON,MA,2493,3,199308,10,29004000,5,-7939436.215861002,5218325.085622116
TEMPLE ETZ CHAIM,900 WASHINGTON ST,FRANKLIN,MA,2038,3,199303,10,1000000,1,-7952984.911085453,5167385.938936612
SUFI ORDER INTL OF GREATER BOSTON,PO BOX 380165,CAMBRIDGE,MA,2238,9,199310,10,1000000,5,-7917358.443890953,5217108.241947797
GREATER GRACE COMMUNITY CHURCH WORLD OUTREACH,5 IDAL ST,PEPPERELL,MA,1463,3,199402,10,1000000,1,-7964234.302227571,5261427.421833589
FULL LIFE GOSPEL CENTER INC,183 NORFOLK ST,DORCHESTER,MA,2124,3,200004,10,0,1,-7912532.076048125,5203992.8375905305
CHURCH OF GOD OF PROPHECY,270 WARREN ST # 272,ROXBURY,MA,2119,3,199305,10,1029000,1,-7912781.654346478,5209212.580543875
LA PRIMERA IGLESIA DE DIOS INC ISMAEL FERNANDEZ,2015 MAIN ST,HARTFORD,CT,6120,3,199908,10,0,1,-8090256.203447874,5128389.535463779
MASJID AN-NUR AND MADINA ISLAMIC SCHOOL,28 CIRCUIT ST,ROXBURY,MA,2119,3,199309,10,1000000,1,-7913247.303776468,5209556.459944531
IGLESIA CRISTO EL REY,158 BROWN AVE APT 2,ROSINDALE,MA,2131,3,199808,10,1000000,1,-7917114.542886627,5203741.0970648145
BRISTOL TRINITY EPISCOPAL CHRUCH INC,143 LINCOLN ST,NORTH EASTON,MA,2356,9,194001,10,0,5,-7916493.71408647,5171124.027110195
RUCNI INC,EMMANUEL GOSPEL CTR 2 SAN JUAN ST,BOSTON,MA,2118,3,199306,10,1002007,1,-7911803.823939351,5212203.72547497
BREAD OF LIFE FULL GOSPEL TEMPLE,35 S MAIN ST,UXBRIDGE,MA,1569,3,199310,10,1007029,1,-7973598.497793098,5172178.867349712
ST JOHNS CHURCH EPISCOPAL,96 GREENFIELD RD STE 1,BOSTON,MA,2126,3,199912,10,0,1,-7915152.202902923,5201263.020985988
MOVIMIENTO EVANGELISTICO MISIONERO EL FARO UNIVERSAL INC,234 HAVERHILL ST,LAWRENCE,MA,1840,3,199304,10,1006029,1,-7921835.602491172,5267957.573570666
CATHEDRAL OF LIFE,242 CAMBRIDGE ST,BOSTON,MA,2114,9,196402,10,1030059,1,-7911153.606793631,5215228.205878462
CHURCH OF GOD OF PROPHECY,20 MORELAND ST,ROXBURY,MA,2119,3,196906,10,200001000,1,-7912835.087702064,5209904.718312515
SPIRITUAL ASSEMBLY OF THE BAHAIS OF LEXINGTON TOWN,32 SCHOOL ST,LEXINGTON,MA,2421,9,199505,10,1000000,1,-7931704.854586433,5227928.79859017
LIVING WORLD CHRISTIAN FELLOWSHIP,PO BOX 269,CHESTER,MA,1011,9,0,10,0,5,-8124495.852426065,5203658.338639001
BOSTON UNITED PENTECOSTAL CHURCH,73 BROOKS ST,BOSTON,MA,2135,3,199407,10,1000000,1,-7921807.327340512,5214285.013815972
SOLID ROCK BAPTIST COMMUNITY CHURCH INC,821 LIBERTY ST,SPRINGFIELD,MA,1104,3,199509,10,1003006,1,-8080052.2136438005,5179765.944114592
HOPE CHRISTIAN CHURCH INC,58 MOUNT VERNON ST,WINCHESTER,MA,1890,3,199510,10,1000000,1,-7918697.172087238,5229090.004959626
BERKSHIRE HILLS SDA SCHOOL,900 CHESHIRE RD RT 8,LANESBORO,MA,1237,9,194704,10,211029000,5,-8147772.423992471,5237738.745675223
NEW VISION CHURCH INC,PO BOX 365705,HYDE PARK,MA,2136,3,200311,10,0,1,-7917167.4196447525,5199709.94603335
MT ZION INC,RRI BOX 185,BRUSTON,NY,12916,3,199308,10,1029003,1,-8294985.326119162,5594837.292941092
RENEWED BAPTIST CHURCH,48 CLINTON ST,FRAMINGHAM,MA,1702,9,195504,10,1000000,5,-7949650.335738743,5203092.440837045
NEW ENGLAND INSTITUTE OF JEWISH STUDIES INC,1894 BEACON ST APT 2,BROOKLINE,MA,2445,3,199401,15,29000000,1,-7920114.3805245245,5211556.597986417
BREAD OF LIFE ASSEMBLY OF GOD,22 STATE RD E,WESTMINSTER,MA,1473,9,196408,10,1002029,5,-8003476.53780252,5243279.049865418
TRINITY LUTHERAN CHURCH,39 PROSPECT ST,GT BARRINGTON,MA,1230,9,198804,10,1000000,1,-8167519.722422762,5190937.929507296
LOWELL MISSION CHURCH INC,403 ANDOVER ST,LOWELL,MA,1852,3,199408,10,1000000,1,-7935984.866368447,5257765.802203508
CHINESE CHRISTIAN CHURCH OF GRACE IN MALDEN,50 EASTERN AVE,MALDEN,MA,2148,3,199311,10,1000000,1,-7911027.927088526,5224691.540742949
THE CHABAD CENTER OF NATICK INC,159 BODEN LN,NATICK,MA,1760,3,199508,10,1000000,1,-7947346.244918299,5203792.708594323
FAITH TEMPLE INC,12 CORNIAN RD,BOSTON,MA,2126,3,199405,10,1007000,1,-7914990.900960766,5201788.943042474
CROSSLIGHT GOSPEL CHURCH,2611 WESTFIELD ST,W SPRINGFIELD,MA,1089,9,196408,10,1002029,5,-8091660.387504738,5177067.540157051
CONGREGATION AM SEGULAH,124 NEWFIELD RD,SPRINGFIELD,MA,1119,1,199405,10,1000000,1,-8072738.857057154,5180606.641140909
CALVARY ASSEMBLY OF GOD,18 S WESTFIELD ST,FEEDING HILLS,MA,1030,9,196408,10,1002029,5,-8090528.156963877,5170930.137577372
NEW HOPE CHRISTIAN FELLOWSHIP,32 CARLETON RD,MILLBURY,MA,1527,3,199402,10,1029000,1,-7992159.353090516,5188305.906428949
DORCHESTER CHURCH OF CHRIST,1505 BLUE HILL AVE,MATTAPAN,MA,2126,3,199311,10,1029201,1,-7914119.937264795,5201943.746595609
REFUGEE-IMMIGRATION MINISTRY,6 PLEASANT ST STE 612,MALDEN,MA,2148,3,199410,15,994029560,1,-7911201.362855181,5225064.93851598
SHALOM COMMUNITY CORP,56 DANJOU DR,MARLBOROUGH,MA,1752,3,200205,10,0,1,-7963026.597071953,5211035.855868742
BAHAIS OF WILLIAMSTOWN TOWN,213 BRESSETT RD,WILLIAMSTOWN,MA,1267,9,199505,10,1000000,1,-8149566.337586599,5260304.157751016
ARK OF THE COVENANT SPIRITUAL BAPTIST CHURCH,373 WASHINGTON ST,DORCHESTER,MA,2124,3,199903,10,998000000,1,-7911815.95776385,5205793.135202424
BAHAIS OF SHELBURNE TOWN,34 ANDERSON RD,SHELBURNE FLS,MA,1370,9,199505,10,1000000,1,-8092378.06426188,5249950.100380258
GREATER FRAMINGHAM COMMUNITY CHURCH,PO BOX 629,FRAMINGHAM,MA,1704,3,201109,10,0,1,-7950321.36962924,5202777.081446953
SAINT ANNAS ORTHODOX CHURCH INC,852 SOUTH ST,ROSLINDALE,MA,2131,3,199711,10,1000000,1,-7918479.987760698,5204310.645099659
LUBAVITCH FOUNDATION OF LEXINGTON INC,9 BURLINGTON ST,LEXINGTON,MA,2420,3,199501,10,1029000,1,-7929594.014402005,5230676.729904592
MORE ABUNDANT LIFE CHRISTIAN OUTREACH MINISTRIES INC,29 ANNAWON ST,SPRINGFIELD,MA,1109,3,199609,15,994007000,1,-8076679.789670216,5177341.08241768
FOUNTAIN OF SALVATION CHRISTIAN CHURCH,165 HAVERHILL ST,LAWRENCE,MA,1840,3,199703,10,1000000,1,-7921442.199410708,5268031.050127184
ADVENT CHRISTIAN CHURCH,560 PLEASANT ST,ATTLEBORO,MA,2703,9,195809,10,0,5,-7933512.237838951,5153976.097478875
BAHAIS OF MONTAGUE TOWN,514 TURNERS FALLS RD,MONTAGUE,MA,1351,9,199505,10,1000000,1,-8074610.805614329,5242588.845767405
GRACE COMMUNITY CHURCH OF CHELMSFORD MASSACHUSETTS,275 BILLERICA RD,CHELMSFORD,MA,1824,3,200006,10,0,1,-7939538.629792533,5250622.999757262
GENERAL COUNCIL CHRISTIAN CHURCH OF NORTH AMERICA,1494 FALL RIVER AVE,SEEKONK,MA,2771,9,198512,10,1000000,5,-7938804.47775075,5129064.625824502
INTERNATIONAL CHURCH OF GOD,24 RAY AVE,BURLINGTON,MA,1803,3,199406,10,1000000,5,-7924246.11474481,5233536.706621125
